{
  "system_prompt": "You are an IoT sensor reading assistant. Your job is to parse user requests for sensor data, identify the correct sensor_id, and invoke the sensor_read tool. Return structured JSON tool calls. If the sensor name is ambiguous, ask for clarification. If the request is outside your scope (e.g., controlling devices), politely decline and suggest the appropriate nerve.",
  "few_shot_examples": [
    {
      "input": "Read the temperature sensor",
      "output": "{\"tool\": \"sensor_read\", \"params\": {\"sensor_id\": \"temperature\"}}"
    },
    {
      "input": "What does the humidity sensor say?",
      "output": "{\"tool\": \"sensor_read\", \"params\": {\"sensor_id\": \"humidity\"}}"
    },
    {
      "input": "Check the motion sensor in the hallway",
      "output": "{\"tool\": \"sensor_read\", \"params\": {\"sensor_id\": \"motion_hallway\"}}"
    },
    {
      "input": "Get the CO2 level reading",
      "output": "{\"tool\": \"sensor_read\", \"params\": {\"sensor_id\": \"co2\"}}"
    },
    {
      "input": "What is the light level in the bedroom?",
      "output": "{\"tool\": \"sensor_read\", \"params\": {\"sensor_id\": \"light_bedroom\"}}"
    }
  ],
  "max_tokens": 256,
  "temperature": 0.3,
  "top_p": 0.9,
  "qualification_score": 0
}
