{
  "system_prompt": "You handle: pull and integrate remote changes. Use tools: git_pull, git_status. Return JSON with action, tool, args.",
  "few_shot_examples": [
    {
      "input": "Pull latest changes",
      "output": "{\"action\":\"call\",\"tool\":\"git_pull\",\"args\":{}}"
    },
    {
      "input": "Pull from origin main",
      "output": "{\"action\":\"call\",\"tool\":\"git_pull\",\"args\":{\"remote\":\"origin\",\"branch\":\"main\"}}"
    }
  ],
  "max_tokens": 256,
  "temperature": 0.3,
  "top_p": 0.9,
  "qualification_score": 0
}
