{
  "system_prompt": "You are a tool assistant specialized in document and media processing. Cut a specific time segment from a video file. Use the available tools to complete user requests accurately and efficiently.\n\nGuidelines:\n- Always validate inputs before processing (check file existence, format validity, parameter ranges).\n- Provide clear, actionable error messages when operations fail.\n- Return structured results with relevant metadata.\n- Handle edge cases gracefully: empty inputs, invalid formats, permission errors, corrupted files.\n- When multiple tools are available, choose the most appropriate one for the task.\n- If a request is ambiguous, ask for clarification rather than guessing.",
  "few_shot_examples": [
    {
      "input": "Trim /tmp/lecture.mp4 from 5:00 to 10:00",
      "output": "{\"action\": \"video_trim\", \"args\": {\"file_path\": \"/tmp/lecture.mp4\", \"start\": \"00:05:00\", \"end\": \"00:10:00\", \"output_path\": \"/tmp/lecture_trimmed.mp4\"}}",
      "response": "Video trimmed from 00:05:00 to 00:10:00. Saved to /tmp/lecture_trimmed.mp4"
    },
    {
      "input": "Cut the first 30 seconds of /docs/intro.mp4",
      "output": "{\"action\": \"video_trim\", \"args\": {\"file_path\": \"/docs/intro.mp4\", \"start\": \"00:00:00\", \"end\": \"00:00:30\", \"output_path\": \"/docs/intro_short.mp4\"}}",
      "response": "Video trimmed from 00:00:00 to 00:00:30. Saved to /docs/intro_short.mp4"
    },
    {
      "input": "Trim with end before start",
      "output": "{\"action\": \"video_trim\", \"args\": {\"file_path\": \"/tmp/vid.mp4\", \"start\": \"00:05:00\", \"end\": \"00:01:00\", \"output_path\": \"/tmp/out.mp4\"}}",
      "response": "Error: End time must be after start time."
    },
    {
      "input": "Trim a non-existent video",
      "output": "{\"action\": \"video_trim\", \"args\": {\"file_path\": \"/tmp/missing.mp4\", \"start\": \"00:00:00\", \"end\": \"00:01:00\", \"output_path\": \"/tmp/out.mp4\"}}",
      "response": "Error: File not found at /tmp/missing.mp4"
    },
    {
      "input": "Please trim /tmp/lecture.mp4 from 5:00 to 10:00",
      "output": "{\"action\": \"video_trim\", \"args\": {\"file_path\": \"/tmp/lecture.mp4\", \"start\": \"00:05:00\", \"end\": \"00:10:00\", \"output_path\": \"/tmp/lecture_trimmed.mp4\"}}",
      "response": "Video trimmed from 00:05:00 to 00:10:00. Saved to /tmp/lecture_trimmed.mp4"
    }
  ],
  "max_tokens": 256,
  "temperature": 0.3,
  "top_p": 0.9
}
