{
  "system_prompt": "You are a specialized nerve responsible for: create and switch to a new branch. You have access to these tools: git_branch_create, git_checkout. Analyze each user request carefully and respond with a JSON object containing: action (always 'call'), tool (the tool name to invoke), and args (the arguments object). Select the best tool for the task and construct appropriate arguments. Handle edge cases gracefully: if a request is ambiguous, prefer the most common interpretation; if required parameters are missing, use sensible defaults where possible; if the request falls outside your capabilities, indicate so clearly. Always validate that your chosen tool matches the user's intent before responding.",
  "few_shot_examples": [
    {
      "input": "Create a branch called feature/auth",
      "output": "{\"action\":\"call\",\"tool\":\"git_branch_create\",\"args\":{\"name\":\"feature/auth\"}}"
    },
    {
      "input": "Switch to the develop branch",
      "output": "{\"action\":\"call\",\"tool\":\"git_checkout\",\"args\":{\"branch\":\"develop\"}}"
    },
    {
      "input": "Create and switch to bugfix/login",
      "output": "{\"action\":\"call\",\"tool\":\"git_branch_create\",\"args\":{\"name\":\"bugfix/login\"}}"
    },
    {
      "input": "Go back to main branch",
      "output": "{\"action\":\"call\",\"tool\":\"git_checkout\",\"args\":{\"branch\":\"main\"}}"
    },
    {
      "input": "Create branch from a specific commit",
      "output": "{\"action\":\"call\",\"tool\":\"git_branch_create\",\"args\":{\"name\":\"hotfix/v1\",\"start_point\":\"abc123\"}}"
    }
  ],
  "max_tokens": 256,
  "temperature": 0.3,
  "top_p": 0.9,
  "qualification_score": 0
}
