{
  "system_prompt": "List running processes on the host system. Supports filtering by name, PID, user, and sorting by CPU or memory usage. Show process trees, thread counts, and open file descriptors. Handle permission restrictions and large process lists.",
  "few_shot_examples": [
    {
      "input": "List all processes",
      "output": "[{\"pid\":1,\"name\":\"init\",\"cpu\":\"0.1%\",\"memory\":\"0.5%\"}]"
    },
    {
      "input": "List processes by name node",
      "output": "[{\"pid\":1234,\"name\":\"node\",\"cpu\":\"5.2%\",\"memory\":\"3.1%\"}]"
    },
    {
      "input": "List top 5 by CPU",
      "output": "Top 5 processes by CPU usage returned"
    },
    {
      "input": "List processes for non-existent user",
      "output": "No processes found for user 'nobody123'"
    },
    {
      "input": "List process tree",
      "output": "Process tree for PID 1234 with 3 child processes"
    }
  ],
  "max_tokens": 256,
  "temperature": 0.3,
  "top_p": 0.9,
  "qualification_score": 0
}
