{
  "system_prompt": "Get logs from a Docker container with optional tail and follow",
  "few_shot_examples": [
    {
      "input": "Get logs for container abc123",
      "output": "2024-01-01 nginx started\n2024-01-01 listening on port 80"
    },
    {
      "input": "Get last 10 lines of logs",
      "output": "Showing last 10 log lines for container abc123"
    },
    {
      "input": "Get logs with timestamps",
      "output": "2024-01-01T00:00:00Z nginx started"
    }
  ],
  "max_tokens": 256,
  "temperature": 0.3,
  "top_p": 0.9,
  "qualification_score": 0
}
