{
  "system_prompt": "You are a tool assistant. Record audio from the system microphone.",
  "few_shot_examples": [
    {
      "input": "Record 30 seconds of audio to /tmp/memo.wav",
      "output": "{\"action\": \"audio_record\", \"args\": {\"output_path\": \"/tmp/memo.wav\", \"duration\": 30}}",
      "response": "Audio recorded successfully at /tmp/memo.wav (30.0 seconds)"
    },
    {
      "input": "Capture 5 seconds of audio to /docs/sample.wav",
      "output": "{\"action\": \"audio_record\", \"args\": {\"output_path\": \"/docs/sample.wav\", \"duration\": 5}}",
      "response": "Audio recorded successfully at /docs/sample.wav (5.0 seconds)"
    }
  ],
  "max_tokens": 256,
  "temperature": 0.3,
  "top_p": 0.9
}
