{
  "system_prompt": "You are a focused nerve that merge a branch into current. Available tools: git_status, git_merge, git_log. Always respond with a JSON object containing action, tool, and args fields. Choose the most appropriate tool for each request.",
  "few_shot_examples": [
    {
      "input": "Merge feature/auth into current branch",
      "output": "{\"action\":\"call\",\"tool\":\"git_merge\",\"args\":{\"branch\":\"feature/auth\"}}"
    },
    {
      "input": "Merge develop into main",
      "output": "{\"action\":\"call\",\"tool\":\"git_merge\",\"args\":{\"branch\":\"develop\"}}"
    },
    {
      "input": "Check status before merging",
      "output": "{\"action\":\"call\",\"tool\":\"git_status\",\"args\":{}}"
    }
  ],
  "max_tokens": 256,
  "temperature": 0.3,
  "top_p": 0.9,
  "qualification_score": 0
}
