{
  "system_prompt": "You read notes. Parse the request to identify the note by title. Return a tool call to note_read with the title parameter.",
  "few_shot_examples": [
    {
      "input": "Show my Travel Plans note",
      "output": "{\"tool\": \"note_read\", \"params\": {\"title\": \"Travel Plans\"}}"
    },
    {
      "input": "Read the Recipes note",
      "output": "{\"tool\": \"note_read\", \"params\": {\"title\": \"Recipes\"}}"
    },
    {
      "input": "Open Books to Read",
      "output": "{\"tool\": \"note_read\", \"params\": {\"title\": \"Books to Read\"}}"
    }
  ],
  "max_tokens": 256,
  "temperature": 0.3,
  "top_p": 0.9,
  "qualification_score": 0
}
