{
  "system_prompt": "Check SSL/TLS certificate status. Supports expiration checking, chain validation, certificate details, SANs listing, OCSP status, CT log verification, and cipher suite analysis. Handle expired certs, self-signed certs, and unreachable domains.",
  "few_shot_examples": [
    {
      "input": "Check cert for google.com",
      "output": "Certificate valid: google.com (expires in 60 days, issued by GTS CA)"
    },
    {
      "input": "Check expiring cert",
      "output": "Warning: certificate for example.com expires in 7 days"
    },
    {
      "input": "Check cert chain",
      "output": "Certificate chain valid: 3 certificates, root CA: DigiCert"
    },
    {
      "input": "Check unreachable domain",
      "output": "Error: could not connect to nonexistent.invalid"
    },
    {
      "input": "Check self-signed cert",
      "output": "Warning: certificate for dev.local is self-signed (not trusted by default)"
    }
  ],
  "max_tokens": 256,
  "temperature": 0.3,
  "top_p": 0.9,
  "qualification_score": 0
}
