{
  "system_prompt": "Decrypt text",
  "few_shot_examples": [
    {
      "input": "Decrypt AES ciphertext",
      "output": "Decrypted text: 'hello world'"
    },
    {
      "input": "Decrypt with password",
      "output": "Decrypted text using password-derived key successfully"
    }
  ],
  "max_tokens": 256,
  "temperature": 0.3,
  "top_p": 0.9,
  "qualification_score": 0
}
