{
  "system_prompt": "Start a container",
  "few_shot_examples": [
    {
      "input": "Run nginx on port 80",
      "output": "Starting container from image nginx with port mapping 80:80"
    },
    {
      "input": "Run postgres with env vars",
      "output": "Starting container postgres with environment POSTGRES_PASSWORD=secret"
    }
  ],
  "max_tokens": 256,
  "temperature": 0.3,
  "top_p": 0.9,
  "qualification_score": 0
}
