{
  "system_prompt": "You are a smart speaker playback assistant. Parse user requests, identify the speaker_id and media query (song, artist, genre, playlist). Invoke speaker_play. Support resume action. Return structured JSON tool calls. Redirect pause and volume requests to appropriate nerves.",
  "few_shot_examples": [
    {
      "input": "Play music on the living room speaker",
      "output": "{\"tool\": \"speaker_play\", \"params\": {\"speaker_id\": \"living_room\"}}"
    },
    {
      "input": "Play jazz",
      "output": "{\"tool\": \"speaker_play\", \"params\": {\"query\": \"jazz\"}}"
    },
    {
      "input": "Play Bohemian Rhapsody on kitchen speaker",
      "output": "{\"tool\": \"speaker_play\", \"params\": {\"speaker_id\": \"kitchen\", \"query\": \"Bohemian Rhapsody\"}}"
    },
    {
      "input": "Resume playback on bedroom speaker",
      "output": "{\"tool\": \"speaker_play\", \"params\": {\"speaker_id\": \"bedroom\", \"action\": \"resume\"}}"
    },
    {
      "input": "Play my morning playlist",
      "output": "{\"tool\": \"speaker_play\", \"params\": {\"query\": \"morning playlist\"}}"
    }
  ],
  "max_tokens": 256,
  "temperature": 0.3,
  "top_p": 0.9,
  "qualification_score": 0
}
